asin,brand,title,amazon_subcategory,reasoning
B00028OC90,eclectic,"eclectic institute kids herbs lemon balm, lemon flavor  calming and nervous system support  1 fl oz (30 ml)",other herbal supplements,Title keyword filter: 'balm'
B01BWNDS2A,dr. organic,dr organic hemp rescue shampoo,cbd & hemp extract products,Title keyword filter: 'shampoo'
B01K6VRGHM,good medicine beauty lab,every little thing balm (4 oz.),non-aspirin pain relievers,Title keyword filter: 'balm'
B01KURJYHC,harmonize,harmonize seven chakra spinning quartz merkaba energy generator spiritual reiki healing gemstones,other alternative medicine,Title keyword filter: 'gemstone'
B076JTBNHK,bianca rosa,"bianca rosa vitex chasteberry cream (2 oz, zin: 512765) - 3 pack",other herbal supplements,Title keyword filter: 'cream'
B078YGRNPJ,remove,advil pain reliever/fever reducer liqui-gels 200mg - 20 ct  pack of 4,non-aspirin pain relievers,Title keyword filter: 'gel'
B07PHR8V8N,tumbeelluwa,tumbeelluwa stone pendant necklace amulet reiki healing crystal with nylon cord handmade jewelry for women,other alternative medicine,Title keyword filter: 'jewelry'
B07R2D2XCT,real-gems,unique natural aqua sky aquamarine energy stone 12.20 ct certified aquamarine gemstone healing power for jewelry making,other alternative medicine,Title keyword filter: 'jewelry'
B07R8SPN1S,aland,aland health care weight loss fat burning slimming magnetic ring rhinestone jewelry golden us 7,fat burners,Title keyword filter: 'jewelry'
B07RR182CH,strive,"strive body and skin irritation cream | natural formula for wrist, hand, leg and more | 2 oz jar | made in the usa",other mineral supplements,Title keyword filter: 'cream'
B07TPMN71Z,gemhub,gemhub green amethyst emerald  square cut 50-141.70 carats loose gemstones for jewelry making,other alternative medicine,Title keyword filter: 'jewelry'
B07Y8L1DH1,cussing cups,"seven chakra tree of life, crystal tree for positive energy, 7 chakra tree, feng shui tree, stone decor natural artificial tree, 7 chakra tree of life healing gemstones pendant",other alternative medicine,Title keyword filter: 'gemstone'
B07YWK3HQN,gemmartusa loose gemstone,"aaa natural amethyst, loose stones, jewelry setting stone, precious stones, ring setting stone, february gemstone, 1 carat (am-60100)",other alternative medicine,Title keyword filter: 'jewelry'
B083XG7BQ8,candykorner,candykorner champagne bubbles | champagne bubble gels,elderberry herbal supplements,Title keyword filter: 'gel'
B086H55F2S,biolabs pro,estrogen - all natural bioidentical estrogen bi-est 5.0 - hormone replacement menopause relief estrogen cream for women - estriol & estradiol - maximum strength - two month supply - 3oz,feminine menopause products,Title keyword filter: 'cream'
B08C1C5LFD,tr toppers,mini gummi bears candy 5 lbs,elderberry herbal supplements,Title keyword filter: 'candy'
B08CDXKHXZ,herbera,"herbera superior temper a60 alcohol extract tincture: ashwagandha root, st. john's wort herb, ginkgo biloba leaf, lemon balm leaf. mood balance formula 2 fl oz",other herbal supplements,Title keyword filter: 'balm'
B08JN3GKJQ,oil of youth,oil of youth essential oils 8oz - cinnamon bark essential oil - 8 fluid ounces,cbd & hemp extract products,Title keyword filter: 'essential oil'
B08NPP2T5N,lizifang,lizifang 10mm natural yellow citrine gemstone abacus crystal bead woman pixiu bracelet,other alternative medicine,Title keyword filter: 'gemstone'
B08Q3ZQ3FH,pranarom,pranarom - lemongrass essential oil 5ml,other alternative medicine,Title keyword filter: 'essential oil'
B08RDL1VP4,exportmall,charak ayurvedic kofol syrup (100 ml) by exportmall,cold & flu treatments,Title keyword filter: 'syrup'
B08T69MQLW,skullis,"skullis 5.0 argentinian onyx crystal skull, hand carved gemstone fine art sculpture, reiki healing stone statue. 878 z8",other alternative medicine,Title keyword filter: 'gemstone'
B08YDYH8FD,maxhemp,2 pack organic hemp gummies 3000 extra strengthen high potency with pure hemp oil extract vegan edible bear candy fruit flavor made in us,cbd & hemp extract products,Title keyword filter: 'candy'
B091DXTT86,patchmd,patchmd - nad+ total recovery patches - 30 days supply,antioxidants,Title keyword filter: 'patch'
B09BF4XHRH,sent from earth,"sent from earth caffeine saw palmetto ketoconazole biotin dandruff treatment: antifungal for psoriasis, dermatitis, dry itchy scalp vegan advanced natural formula shampoo 16.9 fl.oz. (8.45 pack of 2)",saw palmetto herbal supplements,Title keyword filter: 'shampoo'
B09GL8F524,spoonz,"spoonz sqwincher zero qwik stik - sugar free electrolyte powdered beverage mix, assorted flavors (40 sticks) with fog wipe",electrolyte drink mixes & supplements,Title keyword filter: 'wipe'
B09JY9BKZD,orca beauty,"biotin hair growth serum, biotin for hair growth oil, biotin hair oil - biotin oil, natural dht blocker hair serum for hair growth, anti-thinning liquid biotin hair growth serum women (2oz)","hair, skin & nails supplements",Title keyword filter: 'serum'
B09JZF76K3,craftdady,craftdady 5pcs natural black labradorite humb worry stone healing crystal heart love palm pocket gemstones for meditation reiki balancing,other alternative medicine,Title keyword filter: 'gemstone'
B09JZGXRMW,craftdady,craftdady 5pcs natural gray labradorite thumb worry stone healing crystal heart love palm pocket gemstones for meditation reiki balancing,other alternative medicine,Title keyword filter: 'gemstone'
B09NQMQ51Z,usamjtable,usamjtable feng shui 4'' happy face laughing buddha glow in the dark figurine statue green crystal gemstone carved wealth and good luck,other alternative medicine,Title keyword filter: 'gemstone'
B09PZ2RVZM,real-gems,real-gems natural blue aquamarine 54 ct. crystal healing raw rough loose gemstone axd-456,other alternative medicine,Title keyword filter: 'gemstone'
B09SG2QRJ3,pola,pola inner liftia collagen core form foundation 90 sticks for 90days,collagen supplements,Title keyword filter: 'foundation'
B09W9TZBBL,masgemes,"masgemes rose quartz tree gemstone crystal tree of life,amethyst cluster base,healing pink crystal chakra balancing positive energy,table bonsai feng shui decor money tree 10-11",other alternative medicine,Title keyword filter: 'gemstone'
B09YP9GWL7,masgemes,"masgemes gemstone crystal tree of life, chakra tree, natural amethyst & rose quartz, feng shui home decor, positive energy healing crystals",other alternative medicine,Title keyword filter: 'gemstone'
B09YPB4PZZ,masgemes,"masgemes chakra gemstone crystal tree of life,natural amethyst&clear crystal&moonstone with clear quartz base,bonsai money tree,healing crystal positive energy,feng shui home decor",other alternative medicine,Title keyword filter: 'gemstone'
B09ZTG3XPG,masgemes,"masgemes healing gemstone crystal money tree, natural amethyst rose quartz aquamarine feng shui bonsai money tree home decoration for wealth and luck",other alternative medicine,Title keyword filter: 'gemstone'
B0B1KGXJSC,crunchyroll,one piece: collection 30 - blu-ray + dvd,chondroitin & glucosamine,Title keyword filter: 'dvd'
B0B2JX8KF7,maxhemp,"4 pack organic hemp gummies 500,000 extra strengthen high potency with pure hemp oil extract vegan edible bear candy made in us",cbd & hemp extract products,Title keyword filter: 'candy'
B0B3TJW2C6,jewever,jewever 2pcs anklet bracelets for women 7 chakra healing crystals essential oils diffuser worry stone energy balancing meditation yoga gifts beach foot (lava stone & agate),other alternative medicine,Title keyword filter: 'essential oil'
B0B5MX4S2H,justinstones,justinstones large rainbow coated pyrite crystal tower healing crystal wand for spiritual use hexagonal point reiki chakra gemstone home office decor,other alternative medicine,Title keyword filter: 'gemstone'
B0B77QBHCC,skullis,"skullis 5.0 crazy lace agate crystal skull, hand carved gemstone fine art sculpture, reiki healing stone statue.592 z8",other alternative medicine,Title keyword filter: 'gemstone'
B0B7XCRSLQ,qinjiejie,bundle of 10 pcs colorful assorted crystals heart stones and 10 pcs rose quartz crystals wands stones healing gemstones reiki energy balancing meditation,other alternative medicine,Title keyword filter: 'gemstone'
B0BGLS3Q4H,amazing gemstone,amazing gemstone japa mala 108 prayer beads necklace and wrist mala bracelet for meditation,other alternative medicine,Title keyword filter: 'gemstone'
B0BMLWGLVM,amazing gemstone,amazing gemstone japa mala 108 prayer beads necklace and wrist mala bracelet for meditation,other alternative medicine,Title keyword filter: 'gemstone'
B0BNVK29B9,justinstones,natural african amethyst gemstone healing crystal freeform point reiki chakra pendant pendulum and neckalce,other alternative medicine,Title keyword filter: 'gemstone'
B0BR74SQN1,justinstones,justinstones yellow tiger eye hand carved gemstone puppy healing crystals chakra reiki dog figurine animal collection for home decor 2 inch,other alternative medicine,Title keyword filter: 'gemstone'
B0BTT7XKVN,subsh,subsh moss agate crystals and healing stones - tumbled crystals bulk - crystal gemstones healing - collection of stones in a suitcase - crystal kit - metaphysical gifts,other alternative medicine,Title keyword filter: 'gemstone'
B0BTT8V2JZ,subsh,subsh citrine crystal stone - tumble gemstone - healing crystals set - bundle of crystals - meditation accessories - cool rocks - crystal sets for healing - spiritual gifts,other alternative medicine,Title keyword filter: 'gemstone'
B0BTVPJ8Z3,subsh,subsh labradorite gemstones - crushed small crystals - rocks for tumbling - authentic stones and crystals - crystal set - crystal grid - chakra crystals - healing crystal decor,other alternative medicine,Title keyword filter: 'gemstone'
B0BVBB5K2R,naribabu,naribabu clear quartz crystal necklace - gemstone necklace - crystal jewelry - crystal pendants - spiritual jewelry - stone pendant - tumbled stone - stones and crystals - reiki gifts,other alternative medicine,Title keyword filter: 'jewelry'
B0BVBBNMF7,naribabu,naribabu green jade crystal - green crystal necklace - jade necklace - crystal jewelry - stone pendant - spiritual jewelry - gemstone necklace - healing stones - tumbled stone - reiki gifts,other alternative medicine,Title keyword filter: 'jewelry'
B0BVBG2V4P,naribabu,"naribabu lapis lazuli crystal pendant necklace - blue stone - healing chakra jewelry - unisex adult - 20 inch chain - no metal - 1.4 oz - gift for all ages, both genders, gift givers",other alternative medicine,Title keyword filter: 'jewelry'
B0BW99GD1W,pyor,"black tourmaline, crystal necklace, spiritual gifts for women, crystals and stones, moon necklace, hippie jewelry, crystal gifts, black tourmaline crystals, stone necklace, spiritual jewelry",other alternative medicine,Title keyword filter: 'jewelry'
B0BWSK65MG,american green,"american green 10,000mg hemp cream (plain)",cbd & hemp extract products,Title keyword filter: 'cream'
B0C1N74PGK,hmone,"3 packs organic hemp gummies extra strengthen high potency with pure hemp oil extract vegan edible bear candy - non-gmo, vegan, low sugar, made in usa",cbd & hemp extract products,Title keyword filter: 'candy'
B0C1Y81C15,fuqimanman2020,12 constellation zodiac sign choker necklace raw crystal natural stone healing chakra gemstone horoscope astrology jewelry for women birthday gift,other alternative medicine,Title keyword filter: 'jewelry'
B0C3GVVPF2,anaya agate,labradoritecrystalbraceletâgemstonebeadbraceletwithadjustablemacramestringâchicgemstonebraceletformenandwomenâ8mmroundhealingcrystalbeadbracelets,other alternative medicine,Title keyword filter: 'gemstone'
B0C3ZRTS4V,tgh,"tgh tgh natural clear quartz chips bar necklace, energy healing crystals, birthday gift for her, gemstone jewelry 18 inch aa+ quality, valentine day gift (clear quartz)",other alternative medicine,Title keyword filter: 'jewelry'
B0C53CVKSH,justinstones,justinstones lepidolite lithium mica moon sphere luna surface texture 40mm ball gemstone crystal healing care office decor stone crafts with 7 chakra crown holder,other alternative medicine,Title keyword filter: 'gemstone'
B0C5T32K7S,tgh,"tgh natural amazonite chips crystal earring, yoga jewelry, meditation earring, raw gemstone, energy healing crystals, birthday, gemstone jewelry, gift for her, valentine day gift (amazonite)",other alternative medicine,Title keyword filter: 'jewelry'
B0C7VC8XBY,tgh,"tgh natural blue apatite chips crystal earring, yoga jewelry, meditation earring, crystals earring, energy healing crystals, birthday, gemstone jewelry, valentine day gift (blue apatite)",other alternative medicine,Title keyword filter: 'jewelry'
B0C8JH8X84,masgemes,"masgemes natural amethyst gemstone crystal tree of life, clear quartz base, chakra money bonsai feng shui, positive energy healing crystals home decor, spiritual gifts size 10-11",other alternative medicine,Title keyword filter: 'gemstone'
B0C99B543H,owmell,owmell tiny sleeping cat statue hand-carved healing stone gemstone little kitten statue figurine 2 - rose quartz cat,other alternative medicine,Title keyword filter: 'gemstone'
B0CBBJ7XVC,tgh,"natural clear quartz heart crystals earring, heart gemstone, energy healing crystals, birthday, gift for her, gemstone jewelry, valentine day gift (clear quartz)",other alternative medicine,Title keyword filter: 'jewelry'
B0CBBKFT2M,tgh,"natural smoky quartz heart crystals earring, heart gemstone, energy healing crystals, birthday, gift for her, gemstone jewelry, valentine day gift (smoky quartz)",other alternative medicine,Title keyword filter: 'jewelry'
B0CBBKM7QK,tgh,"natural labradorite heart crystals earring, heart gemstone, energy healing crystals, birthday, gift for her, gemstone jewelry, valentine day gift (labradorite)",other alternative medicine,Title keyword filter: 'jewelry'
B0CBBNGDVJ,tgh,"natural black onyx heart crystals earring, heart gemstone, energy healing crystals, birthday, gift for her, gemstone jewelry, valentine day gift (black onyx)",other alternative medicine,Title keyword filter: 'jewelry'
B0CBQK3QNG,dr teal's,"dr. teal's hemp seed oil foaming bath gift set (2 pack, 34oz ea) - cannabis sativa hemp seed oil - essential oils blended with pure epsom salt calm the senses & alleviates daily stress",cbd & hemp extract products,Title keyword filter: 'essential oil'
B0CD35GSJX,cocokind,"cocokind watermelon hemp oil, lightweight dry oil for skin, body and hair use as beard oil, soften, smooth, and replenish with a lightly scented essential oil blend, 1 fl oz",cbd & hemp extract products,Title keyword filter: 'essential oil'
B0CG5FR961,kcrpm,"kcrpm pulsera arus 7 chakras original, 7 chakra bracelet with real stones, 7 chakra necklace and bracelet set for women and men, jewelry set for spiritual healing",other alternative medicine,Title keyword filter: 'jewelry'
B0CGSKKZQS,o positiv,"flo pms gummies for women - proactive pms relief - targets hormonal acne, bloating, cramps, & mood swings with chasteberry, vitamin b6, & lemon balm - pms gummies (pack of 2)",cbd & hemp extract products,Title keyword filter: 'balm'
B0CJ8CVZWC,goodstuff,premium st. lucia sea moss gel: nature's ultimate multi-vitamin and skin superfood (16oz),superfoods,Title keyword filter: 'gel'
B0CJCD2JM3,maxhemp,"2 pack organic hemp gummies extra strengthen high potency with pure hemp oil extract, vegan, non-gmo, edible bear candy made in us",cbd & hemp extract products,Title keyword filter: 'candy'
B0CJCP6DD3,my adventure to fit,"keto electrolytes powder no sugar - made in the usa electrolyte mix for women & men - hydrating electrolyte drinks for energy, muscle function, & appetite control (pear candy, 37.5 servings)",electrolyte drink mixes,Title keyword filter: 'candy'
B0CJN8Q4FF,hmone,"hmone hemp gummies high potency organic extra strength made with hemp oil vegan edible bear candy, non-gmo, low sugar, made in usa - 2 packs",cbd & hemp extract products,Title keyword filter: 'candy'
B0CJNJBHGM,gem-inside create your own fashion,gem-inside 20mm rose quartz stone circle donuts beads for pendant jewelry making power energy chakra massage guasha scraping tools,other alternative medicine,Title keyword filter: 'jewelry'
B0CL1Z75VP,tumbeelluwa,"tumbeelluwa 8mm healing crystal bracelet natural white shell star moon bead stone handmade stretch wrist jewelry spiritual gift for women, black obsidian",other alternative medicine,Title keyword filter: 'jewelry'
B0CM2SGKJZ,just ripe nutrition,"colonbright psyllium husk powder colon cleanser - colon cleanse for constipation relief, bloating relief & gut health, vegan, gluten free fiber supplement - healthy digestive function 30 servings (6)",dietary fibers,Title keyword filter: 'cleanser'
B0CMHGWXJF,handmade,"2 pcs,8x6 mm, aura gems natural ethiopian opal,briliant cut, pear, shape, jewelry making supply, chakra energy healing gemstone, real crystal, birthstone, wholesale deal",other alternative medicine,Title keyword filter: 'jewelry'
B0CMJW6JMN,wellness labsrx,"irish sea moss gel organic raw - wildcrafted superfood seamoss gel - pineapple mango flavor, vitamin and mineral-rich from pristine caribbean waters - 10 oz.",superfoods,Title keyword filter: 'gel'
B0CNS2ZWF6,carethetic,"[5 pack] carethetic fsh menopause test kit - midstream at-home menopause test, high-sensitivity fsh detection for perimenopause & fertility monitoring",menopause care products,Title keyword filter: 'test kit'
B0CPLNMKH2,tgh,"natural tanzanite chips bar necklace, energy healing crystals, birthday, gift for her, gemstone jewelry 18 inch aa+ quality, valentine day gift (tanzanite)",other alternative medicine,Title keyword filter: 'jewelry'
B0CPPZ49ZB,amazing gemstone,"titanium aura quartz crystal chips aquarium gravel rocks - aura quartz chips bulk fish tank gravel, small tumbled stone chips and tiny crystals for decoration (natural aaa grade gemstones)",other alternative medicine,Title keyword filter: 'gemstone'
B0CR7SPV8R,handmade,hand crafted menopause relief natural gemstone energy stretchy bracelet (m-7 inches in diameter),menopause care products,Title keyword filter: 'gemstone'
B0CRR312MD,justinstones,50mm natural red jasper black obsidian pink quartz aventurine hexagonal wand jewelry making crystal pointed chakra reiki healing beads 2mm hole drilled(pack of 5),other alternative medicine,Title keyword filter: 'jewelry'
B0CTKZM392,metjakt,metjakt handmade original healing crystal 8mm faceted gemstone stretch bracelet with 18k platinum beads and micro pave cz ruby ball for women (purple tiger's eye),other alternative medicine,Title keyword filter: 'gemstone'
B0CTXD1LGD,ayush gems,"ayush gems 21.25 ratti 20.00 carat pyrite stone original raw stone energy natural iron pyrite stone gold rock used for increased willpower and attract money(certified pyrite, loose gemstone, pyrite,,",other alternative medicine,Title keyword filter: 'gemstone'
B0CWLS8T9B,5kind clinical skincare,5kind melatonin sleep patches for adults - pack of 18,medicinal sleep aids,Title keyword filter: 'patch'
B0CX1ZZYG2,anaya agate,"anayaagategreenjadecrystalpendulumâchakrapendulumfornecklacewithchainâdowsingpendulumfordivination,meditation,chakrahealingandcrystalgridânaturalgemstonependulum",other alternative medicine,Title keyword filter: 'gemstone'
B0CX212Q9R,anaya agate,"anayaagatepyritecrystalpendulumâchakrapendulumfornecklacewithchainâdowsingpendulumfordivination,meditation,chakrahealingandcrystalgridânaturalgemstonependulum",other alternative medicine,Title keyword filter: 'gemstone'
B0CX213K4B,anaya agate,"anayaagateunakitecrystalpendulumâchakrapendulumfornecklacewithchainâdowsingpendulumfordivination,meditation,chakrahealingandcrystalgridânaturalgemstonependulum",other alternative medicine,Title keyword filter: 'gemstone'
B0CX215FR6,anaya agate,"orangeselenitecrystalpendulumâchakrapendulumfornecklacewithchainâdowsingpendulumfordivination,meditation,chakrahealingandcrystalgridânaturalgemstonependulum",other alternative medicine,Title keyword filter: 'gemstone'
B0CX217NGP,anaya agate,"tigereyecrystalpendulumâchakrapendulumfornecklacewithchainâdowsingpendulumfordivination,meditation,chakrahealingandcrystalgridânaturalgemstonependulum",other alternative medicine,Title keyword filter: 'gemstone'
B0CX21LKH6,anaya agate,"anayaagatesodalitecrystalpendulumâchakrapendulumfornecklacewithchainâdowsingpendulumfordivination,meditation,chakrahealingandcrystalgridânaturalgemstonependulum",other alternative medicine,Title keyword filter: 'gemstone'
B0CX21Z3SP,anaya agate,"anayaagatelepidolitependulumâchakracrystalpendulumfornecklacewithchainâdowsingpendulumfordivination,meditation,chakrahealingandcrystalgridânaturalgemstonependulum",other alternative medicine,Title keyword filter: 'gemstone'
B0CX2542M2,love noobs,"award-winning lactation cookies for milk supply increase by lovenoobs, lactation snacks help for breastfeeding, on-the-go mom support, breastfeeding essentials, 6x 3.5oz",lactation consumables & supplements,Title keyword filter: 'cookie'
B0CY2FQMM5,tgh,"tgh natural black spinel gemstone handmade beaded necklace, faceted 3-3.5 mm beads energy stones, birthstone, women fashion jewelry gift, mother's day gift (black spinel)",other alternative medicine,Title keyword filter: 'jewelry'
B0CZ26RYR9,herboganic,herboganic natural detox cleanser with living bitters,weight loss detox & cleanse,Title keyword filter: 'cleanser'
B0CZ7JN58S,moofin,"pacific resources international manuka honey new zealand dry cough syrup, 8oz - sore throat & immune support, propolis & vitamin c - bundled hand sanitizer dispenser [pack of 3]",cough syrups & liquids,Title keyword filter: 'syrup'
B0D1K81YM1,patchmd,magna calm topical patch - magnesium patches  30-day supply,magnesium supplements,Title keyword filter: 'patch'
B0D35Z48SZ,diagnox health,diagnox fsh menopause test kit - 5 pack menopause stage indicator - clinical grade midstream fsh test at home,menopause care products,Title keyword filter: 'test kit'
B0D3GSN6BQ,wowagoga,12pcs crystal worry stones bulks moon star shaped crystals gemstones mini astrology crystals and stones for witchcraft supplies diy meditation balancing decor,other alternative medicine,Title keyword filter: 'gemstone'
B0D598F29M,djuetrui,"moondor royal jelly breast enhancement patch 10pcs, women royal jelly breast enhancement patch (1box-10pcs)",royal jelly,Title keyword filter: 'patch'
B0D59Z3663,djuetrui,"djuetrui moondor royal jelly breast enhancement patch 30pcs, women royal jelly breast enhancement patch (3box-30pcs)",royal jelly,Title keyword filter: 'patch'
B0D5CFHR35,zymise,"castor oil pack wrap, highly absorbent self-adhesive castor oil patches, easy to use castor oil wrap organic cotton, no wash, anti oil leak",motion sickness & nausea,Title keyword filter: 'patch'
B0D6FZNY6B,tgh,"natural raw rough gemstone, healing chakra stones, wholesale bulk, birthstone, energy diy craft stone, raw crystals, loose gemstone wire wrapping, jewelry making supply 50 carat lot (carnelian)",other alternative medicine,Title keyword filter: 'jewelry'
B0D6GKRZXH,tgh,"natural aquamarine chips crystal earring, yoga jewelry, meditation crystals earring, raw gemstone, energy healing crystals, birthday, gift for her, gemstone jewelry, mother's day gifts (aquamarine)",other alternative medicine,Title keyword filter: 'jewelry'
B0D7948J3F,tgh,"natural multi sapphire gemstone round beads bolo bracelet, chakra healing crystals, 14k gold plated, adjustable slider, birthday, wedding, handmade, 6-9 inch, valentine day gift (multi sapphire)",other alternative medicine,Title keyword filter: 'gemstone'
B0D794S1HS,tgh,"natural multi tourmaline gemstone round beads bolo bracelet, chakra healing crystals, 14k gold plated, adjustable slider, birthday, wedding, handmade, 6-9 inch, valentine day gift (multi tourmaline)",other alternative medicine,Title keyword filter: 'gemstone'
B0D7J5P4ZV,ronfnea,"nasal irrigation system, nasal care, sinus rinse machine, nasal rinse machine, nasal cleaner with auto waste collection function for sinus, runny nose, nasal congestion purple",sinus medicine,Title keyword filter: 'machine'
B0D8FJWKW3,tgh,"natural peach amazonite oval cabochon necklace, gemstone healing crystals, gift for her, birthstone, 18 inch gold plated adjustable chain, valentine day gift (peach amazonite)",other alternative medicine,Title keyword filter: 'gemstone'
B0D8HX9YP5,tgh,"natural pink strawberry quartz pear cabochon necklace, gemstone healing crystals, gift for her, birthstone, 18 inch gold plated adjustable chain, valentine day gift (pink strawberry quartz)",other alternative medicine,Title keyword filter: 'gemstone'
B0D9CZ6WXV,deepcozy,"electric nasal irrigation system sinus rinse machine with 30 salt packets, nose cleaner for sinus adult, nasal flush system congestion & running nose relief, nose cleaner (device auto-clean)",sinus medicine,Title keyword filter: 'machine'
B0D9JQDD89,tgh,"natural amazonite gemstone round beads bolo bracelet, chakra healing crystals, 14k gold plated, adjustable slider, birthday, wedding, handmade, 6-9 inch, valentine day gift (amazonite)",other alternative medicine,Title keyword filter: 'gemstone'
B0DC3Y1YJT,anaya agate,"pyritependulumâorgonecrystalpendulumâdowsingpendulumfordivination,meditation,chakrahealingânaturalgemstonependulum",other alternative medicine,Title keyword filter: 'gemstone'
B0DCTV13DN,carethetic,"[12 pack] carethetic fsh menopause test strips - rapid at-home menopause stage test kit, high-sensitivity fsh detection",menopause care products,Title keyword filter: 'test kit'
B0DDWZNVQW,liu jun,"liu jun smoking cessation bracelet, quit vaping aid bracelet tiger eye amethyst hematite evil eye bracelet set for women men calming anxiety healing bracelets jewelry",other alternative medicine,Title keyword filter: 'jewelry'
